{
  "formatVersion": 1,
  "kind": "reference-inventory",
  "referenceVersion": "1.0.0",
  "repositoryId": "fixture-repository",
  "entries": [
    {
      "path": ".exphere/README.md",
      "sha256": "96b4328ac8585bfdd1c64da72b33a4a1cb9aebf7d65c98001b72ce6e6daf674c",
      "owner": "distribution",
      "version": "reference-v1",
      "origin": {
        "source": "exphere-authored-fixture",
        "revision": "reference-v1",
        "licenseDisposition": "project-authored-source-only"
      }
    },
    {
      "path": ".exphere/agents/planner.json",
      "sha256": "8f79cf9bf01b930553b02e71cb08963540384272bfe23dc6680e0590181ab7ff",
      "owner": "distribution",
      "version": "reference-v1",
      "origin": {
        "source": "exphere-authored-fixture",
        "revision": "reference-v1",
        "licenseDisposition": "project-authored-source-only"
      }
    },
    {
      "path": ".exphere/guides/execution.md",
      "sha256": "e61cc8b882c003322624542deb4e8a1eca4697d5e90c223ad99b4b9cb61cbe40",
      "owner": "distribution",
      "version": "reference-v1",
      "origin": {
        "source": "exphere-authored-fixture",
        "revision": "reference-v1",
        "licenseDisposition": "project-authored-source-only"
      }
    },
    {
      "path": ".exphere/guides/feature.md",
      "sha256": "ab46360897c92fc922ce3c31350d4e553cbf5ce1d592a7262ada191dfb107ba8",
      "owner": "distribution",
      "version": "reference-v1",
      "origin": {
        "source": "exphere-authored-fixture",
        "revision": "reference-v1",
        "licenseDisposition": "project-authored-source-only"
      }
    },
    {
      "path": ".exphere/guides/handlers.md",
      "sha256": "9c2d61ccb93932c4acc543853eee2dfcb35459156e10847ff879b896ddebdf08",
      "owner": "distribution",
      "version": "reference-v1",
      "origin": {
        "source": "exphere-authored-fixture",
        "revision": "reference-v1",
        "licenseDisposition": "project-authored-source-only"
      }
    },
    {
      "path": ".exphere/guides/model-catalog.md",
      "sha256": "9c10ab57b9d0aa7c8c93e4faf74811a1e441b200afc416b03add2d45dfccd627",
      "owner": "distribution",
      "version": "reference-v1",
      "origin": {
        "source": "exphere-authored-fixture",
        "revision": "reference-v1",
        "licenseDisposition": "project-authored-source-only"
      }
    },
    {
      "path": ".exphere/guides/ownership.md",
      "sha256": "571108f17da8712a524a29976ef8d895b5fdfd24235daf227c0ec006f5de9523",
      "owner": "distribution",
      "version": "reference-v1",
      "origin": {
        "source": "exphere-authored-fixture",
        "revision": "reference-v1",
        "licenseDisposition": "project-authored-source-only"
      }
    },
    {
      "path": ".exphere/guides/templates/spec.md",
      "sha256": "dc958bc9a3f53e157895df99cec9181de4d3e308e8265866cd245bb896b2246e",
      "owner": "distribution",
      "version": "reference-v1",
      "origin": {
        "source": "exphere-authored-fixture",
        "revision": "reference-v1",
        "licenseDisposition": "project-authored-source-only"
      }
    },
    {
      "path": ".exphere/guides/templates/verification.md",
      "sha256": "848bab7060c5b0c8a6a031c3eaea20a060f70ead21b00848d71dfb99be5f589a",
      "owner": "distribution",
      "version": "reference-v1",
      "origin": {
        "source": "exphere-authored-fixture",
        "revision": "reference-v1",
        "licenseDisposition": "project-authored-source-only"
      }
    },
    {
      "path": ".exphere/runtimes/website-preview/README.md",
      "sha256": "2c777f507b8c56bb8104813fe73b58d3da4b5549e0e86572806ee01c53d608fa",
      "owner": "consumer",
      "version": "reference-v1",
      "origin": {
        "source": "exphere-authored-fixture",
        "revision": "reference-v1",
        "licenseDisposition": "project-authored-source-only"
      }
    },
    {
      "path": ".exphere/runtimes/website-preview/schema.json",
      "sha256": "cbc2d6b63f30deaa6019a29f3a9f314eaedee7be3617551249faa8e0c2bb58cc",
      "owner": "consumer",
      "version": "reference-v1",
      "origin": {
        "source": "exphere-authored-fixture",
        "revision": "reference-v1",
        "licenseDisposition": "project-authored-source-only"
      }
    },
    {
      "path": ".exphere/runtimes/website-preview/terraform/main.tf.json",
      "sha256": "d19790fa5a7b691e7d0fd0ce6ca64748e092690bc3f95a00d3c58dd10b09ec5e",
      "owner": "consumer",
      "version": "reference-v1",
      "origin": {
        "source": "exphere-authored-fixture",
        "revision": "reference-v1",
        "licenseDisposition": "project-authored-source-only"
      }
    },
    {
      "path": ".exphere/runtimes/website-preview/units/website/kubernetes/deployment.json",
      "sha256": "2595139519fa7b8a9669eb1f6f68d94501abcea7dc317286aec29dcfd0f65dae",
      "owner": "consumer",
      "version": "reference-v1",
      "origin": {
        "source": "exphere-authored-fixture",
        "revision": "reference-v1",
        "licenseDisposition": "project-authored-source-only"
      }
    },
    {
      "path": ".exphere/runtimes/website-preview/units/website/kubernetes/service.json",
      "sha256": "8f50ae24123401224468539efe31901c9147545b3cba07f18dd993e9b78d3dec",
      "owner": "consumer",
      "version": "reference-v1",
      "origin": {
        "source": "exphere-authored-fixture",
        "revision": "reference-v1",
        "licenseDisposition": "project-authored-source-only"
      }
    },
    {
      "path": ".exphere/sensors/checks.json",
      "sha256": "f8921b3cd9bbd0b1e570ea2427f23cbe46b614aa9bf29c910cd19389d929cbdf",
      "owner": "distribution",
      "version": "reference-v1",
      "origin": {
        "source": "exphere-authored-fixture",
        "revision": "reference-v1",
        "licenseDisposition": "project-authored-source-only"
      }
    },
    {
      "path": ".exphere/skills/review-plan/SKILL.md",
      "sha256": "c2a9dd947c7b1a19d8085284069855ed370e9f33660ef8d6054bf5c9704bdf2c",
      "owner": "distribution",
      "version": "reference-v1",
      "origin": {
        "source": "exphere-authored-fixture",
        "revision": "reference-v1",
        "licenseDisposition": "project-authored-source-only"
      }
    },
    {
      "path": ".exphere/skills/review-plan/criteria.md",
      "sha256": "881d391fa17532d9e3d9aa5b094e9a95e5758990a0b463da609cc48c57a225c4",
      "owner": "distribution",
      "version": "reference-v1",
      "origin": {
        "source": "exphere-authored-fixture",
        "revision": "reference-v1",
        "licenseDisposition": "project-authored-source-only"
      }
    },
    {
      "path": ".exphere/workflow/definition.json",
      "sha256": "5775f570ecaac46feaf91fc7d6c192b039a7dbd7d2f179a5aa8dbdac388f0749",
      "owner": "distribution",
      "version": "reference-v1",
      "origin": {
        "source": "exphere-authored-fixture",
        "revision": "reference-v1",
        "licenseDisposition": "project-authored-source-only"
      }
    },
    {
      "path": ".gitignore",
      "sha256": "bbcd67e8e76308d9c725440f46a71e58318aa8e38695551d67926ab3df4cd89d",
      "owner": "distribution",
      "version": "reference-v1",
      "origin": {
        "source": "exphere-authored-fixture",
        "revision": "reference-v1",
        "licenseDisposition": "project-authored-source-only"
      }
    },
    {
      "path": "README.md",
      "sha256": "db95666ef5c421532d48e495a7769c497d705f6d3bed05c67c2953bdfe6aff45",
      "owner": "distribution",
      "version": "reference-v1",
      "origin": {
        "source": "exphere-authored-fixture",
        "revision": "reference-v1",
        "licenseDisposition": "project-authored-source-only"
      }
    },
    {
      "path": "apps/website/README.md",
      "sha256": "e41fcd28f217f19effd4c5599078bfb09b4cd4dd9600e22c357aaed04776d5b4",
      "owner": "consumer",
      "version": "reference-v1",
      "origin": {
        "source": "exphere-authored-fixture",
        "revision": "reference-v1",
        "licenseDisposition": "project-authored-source-only"
      }
    }
  ]
}
